### ISSUE TITLE
pod-to-pod ping failed across the nodes in the same cluster using secondary interface in GKE

### ISSUE THREAD

**Issue by arifur2021** [containernetworking/cni#846]
I would appreciate any help regarding the following issue

I have deployed 3 pods (2 pods on the same worker node-3 and 3rd one on worker node-3 ) with a secondary interface (using bridge and whereabouts plugins). Pod can ping other pod on the same node but FAILED across the nodes. Following is the snippet
## Config manifest
```
---
apiVersion: "k8s.cni.cncf.io/v1"
kind: NetworkAttachmentDefinition
metadata:
  name: blue
spec:
  config: '{
    "cniVersion": "0.3.0",
    "name": "blue",
    "type": "bridge",
    "bridge": "br0",
    "master": "ens224",
    "forceAddress": false,
    "ipMasq": true,
    "hairpinMode": true,
    "ipam": {
       **"type": "whereabouts",**
       **"range": "192.168.100.0/24"**
        }
    }'
---
apiVersion: v1
kind: Pod
metadata:
  name: ubuntu1
  annotations:
    k8s.v1.cni.cncf.io/networks: blue
spec:
  containers:
    - name: ubuntu1
      image: ubuntu:latest
      # Just spin & wait forever
      command: ["/bin/bash", "-c", "--"]
      args: ["while true; do sleep 30;done;"]
---
apiVersion: v1
kind: Pod
metadata:
  name: ubuntu2
  annotations:
    k8s.v1.cni.cncf.io/networks: blue
spec:
  containers:
    - name: ubuntu2
      image: ubuntu:latest
      # Just spin & wait forever
      command: ["/bin/bash", "-c", "--"]
      args: ["while true; do sleep 30; done;"]
---
apiVersion: v1
kind: Pod
metadata:
  name: centos
  annotations:
    k8s.v1.cni.cncf.io/networks: blue

spec:
  containers:
    - name: centos
      image: docker.io/centos/tools:latest
      command:
        - /sbin/init
      securityContext:
        privileged: true
  nodeSelector:
    kubernetes.io/hostname: user-host2
---
```

## All 3 pods deployed 
```
ubuntu@gke-admin-ws-210511-105308:~$ kubectl --kubeconfig usercluster1-kubeconfig get pods -o wide
NAME                        READY   STATUS    RESTARTS   AGE     IP             NODE         NOMINATED NODE   READINESS GATES
centos                      1/1     Running   0          41s     172.16.2.174   user-host2   <none>           <none>
ubuntu1                     1/1     Running   0          41s     172.16.1.28    user-host3   <none>           <none>
ubuntu2                     1/1     Running   0          41s     172.16.1.143   user-host3   <none>           <none>
ubuntu@gke-admin-ws-210511-105308:~$
```

## All 3 pods got secondary IP address from 192.168.100.0/24 subnet
```
ubuntu@gke-admin-ws-210511-105308:~$ kubectl --kubeconfig usercluster1-kubeconfig exec -it ubuntu1 -- ip -br a
lo               UNKNOWN        127.0.0.1/8
tunl0@NONE       DOWN
net1@if143       UP             192.168.100.3/24  <<<<<<<<
eth0@if140       UP             172.16.1.28/32
ubuntu@gke-admin-ws-210511-105308:~$
```

```
ubuntu@gke-admin-ws-210511-105308:~$ kubectl --kubeconfig usercluster1-kubeconfig exec -it ubuntu2 -- ip -br a
lo               UNKNOWN        127.0.0.1/8
tunl0@NONE       DOWN
net1@if144       UP             192.168.100.2/24  <<<<<<<<
eth0@if142       UP             172.16.1.143/32 
``` 

```
ubuntu@gke-admin-ws-210511-105308:~$ kubectl --kubeconfig usercluster1-kubeconfig exec -it centos -- ip -br a
lo               UNKNOWN        127.0.0.1/8
tunl0@NONE       DOWN
net1@if34        UP             192.168.100.1/24  <<<<<<<<<
eth0@if33        UP             172.16.2.174/32
ubuntu@gke-admin-ws-210511-105308:~$
```
## Pod-1 (ubuntu1) can ping pod-2 (ubuntu2) on the same node
```
ubuntu@gke-admin-ws-210511-105308:~$ kubectl --kubeconfig usercluster1-kubeconfig exec -it ubuntu1 -- ping 192.168.100.2
PING 192.168.100.2 (192.168.100.2) 56(84) bytes of data.
64 bytes from 192.168.100.2: icmp_seq=1 ttl=64 time=0.150 ms
64 bytes from 192.168.100.2: icmp_seq=2 ttl=64 time=0.059 ms
64 bytes from 192.168.100.2: icmp_seq=3 ttl=64 time=0.065 ms
^C
--- 192.168.100.2 ping statistics ---
3 packets transmitted, 3 received, 0% packet loss, time 2038ms
rtt min/avg/max/mdev = 0.059/0.091/0.150/0.041 ms
ubuntu@gke-admin-ws-210511-105308:~$
```

## Pod-1 (ubuntu1) CANNOT ping pod-3 (centos) on the different node
```
ubuntu@gke-admin-ws-210511-105308:~$ kubectl --kubeconfig usercluster1-kubeconfig exec -it ubuntu1 -- ping 192.168.100.100
PING 192.168.100.100 (192.168.100.100) 56(84) bytes of data.
From 192.168.100.3 icmp_seq=1 Destination Host Unreachable
From 192.168.100.3 icmp_seq=2 Destination Host Unreachable
From 192.168.100.3 icmp_seq=3 Destination Host Unreachable
^C
--- 192.168.100.100 ping statistics ---
5 packets transmitted, 0 received, +3 errors, 100% packet loss, time 4079ms
pipe 4
command terminated with exit code 1
ubuntu@gke-admin-ws-210511-105308:~$
```
## Bridge (br0) is UP on worker node
```
root@user-host3:~# ip -br a
lo               UNKNOWN        127.0.0.1/8 ::1/128
ens192           UP             10.176.94.242/26 fe80::250:56ff:fe88:8606/64
docker0          DOWN           169.254.123.1/24
cilium_net@cilium_host UP             fe80::c4d5:bff:fe54:5af3/64
cilium_host@cilium_net UP             172.16.1.32/32 fe80::8c46:2aff:fe05:dd8b/64
lxc_health@if6   UP             fe80::fc5c:6fff:feae:c293/64
lxce4ac00151eb0@if8 UP             fe80::484e:beff:fe13:e114/64
lxc564c8efb9630@if10 UP             fe80::ec55:78ff:fe0d:6d4a/64
lxc895a497cbef7@if12 UP             fe80::9c38:2ff:fe1a:b5d2/64
lxcf7db88499cc8@if14 UP             fe80::bc41:cdff:fe68:6bff/64
lxc4013bcfa1878@if16 UP             fe80::306d:b5ff:fee7:8839/64
lxcfe4501f66869@if18 UP             fe80::346d:95ff:fedd:8bd3/64
lxc770b705598c0@if24 UP             fe80::e835:c8ff:feaa:89e0/64
tunl0@NONE       UNKNOWN        192.168.3.64/32
ens224           UP             fe80::250:56ff:fe88:88c/64  <<<<<<<<<<<<<<<<<<<<
lxc002e252d217d@if67 UP             fe80::8873:d0ff:fe76:7ab6/64
br0              UP             fe80::90cc:d2ff:fe2c:46ba/64      <<<<<<<<<<<<<<<<<<
lxcc7b85c1a76b1@if139 UP             fe80::2016:eff:feee:904c/64
lxc902b5a1dc569@if141 UP             fe80::9c8c:7fff:fe82:30ea/64
vethd71a3134@cilium_net UP             fe80::a8e6:40ff:fe6f:e022/64
vethcd9d6e84@cilium_net UP             fe80::d7:6dff:fe5a:aad8/64
root@user-host3:~#
```

## ARP is showing incomplete for pod-3(centos)
```
ubuntu@gke-admin-ws-210511-105308:~$ kubectl --kubeconfig usercluster1-kubeconfig exec -it ubuntu1 -- arp -n
Address                  HWtype  HWaddress           Flags Mask            Iface
192.168.100.2            ether   f6:1e:60:a7:f5:2d   C                     net1
10.176.94.242            ether   22:16:0e:ee:90:4c   C                     eth0
172.16.1.32              ether   22:16:0e:ee:90:4c   C                     eth0
192.168.100.1                    (incomplete)                              net1    <<<<<<<
ubuntu@gke-admin-ws-210511-105308:~$
```

## Bridge (br0) is allowed in iptables 
```
root@user-host3:~# iptables -L -vn | grep br0
    6   504 ACCEPT     all  --  br0    br0     0.0.0.0/0            0.0.0.0/0
    0     0 ACCEPT     all  --  br0    ens224  0.0.0.0/0            0.0.0.0/0
root@user-host3:~#
```
## TCPdump shows nothing on host interface (ens224) and only arp on br0 as follows
```
root@user-host3:~# tcpdump -i ens224 | grep 192.168.1.1
tcpdump: verbose output suppressed, use -v or -vv for full protocol decode
listening on ens224, link-type EN10MB (Ethernet), capture size 262144 bytes
^C1 packet captured
1 packet received by filter
0 packets dropped by kernel
```

```
root@user-host3:~# tcpdump -i br0
tcpdump: verbose output suppressed, use -v or -vv for full protocol decode
listening on br0, link-type EN10MB (Ethernet), capture size 262144 bytes
15:03:30.365845 ARP, Request who-has 192.168.100.1 tell 192.168.100.3, length 28
15:03:31.393997 ARP, Request who-has 192.168.100.1 tell 192.168.100.3, length 28
15:03:32.417587 ARP, Request who-has 192.168.100.1 tell 192.168.100.3, length 28
15:03:34.439709 ARP, Request who-has 192.168.100.1 tell 192.168.100.3, length 28
15:03:35.453712 ARP, Request who-has 192.168.100.1 tell 192.168.100.3, length 28
```

Any help should be appreciated.

Thanks in advance.

**Comment by squeed** [comment]
Hi there,
This repository is for the CNI specification - we can't support or debug arbitrary setups here. I'm going to close this request.

However, I suspect your issue is that GKE probably has port security enabled, and thus does not provide generic layer-2 connectivity between nodes.
